Issued by Organization,Issued for Organization,Title,Tender No,Procurement Method,Issued Date,Amendments,Closing Date,Successful Vendor,Successful Vendor City,Province,Country,Award Total,Date Awarded,
Ministry of Forests,Ministry of Forests,Wildfire Risk Reduction Treatments along Highway 39 Mackenzie FD,10005-40/FS23DMK012,ITT,2022/09/06,0,2022/09/26,N/A,,,,$0.00,2022/09/29,
Ministry of Forests,Ministry of Forests,Wildfire Risk Reduction Treatments along Highway 39 Mackenzie FD,10005-40/FS23DMK012,ITT,2022/09/06,0,2022/09/26,N/A,,,,$0.00,2022/09/29,
BC Timber Sales - Contracts,BC Timber Sales - Contracts,Taweel & Wavy FSR Bridge Replacements û Kamloops TSA (Kamloops),EN23TEK416,ITT,2022/08/24,0,2022/09/20,Deverell Contracting LTD,Kamloops,British Columbia,Canada,"$371,637.00",2022/09/29,
Ministry of Forests,Ministry of Forests,Powell River Fire Zone - Site Preparation,ITT23BCWSHQ016,ITT,2022/09/14,2,2022/09/27,N/A,,,,$0.00,2022/09/29,
BC Timber Sales - Contracts,BC Timber Sales - Contracts,"Roadside Brushing Minor Works, Sunshine Coast",EN23TBP004,ITT,2022/09/14,1,2022/09/20,Cedarspring Brushing Ltd.,Powell River,British Columbia,Canada,"$67,578.42",2022/09/28,
Ministry of Forests,Ministry of Forests,Robson Valley Road Ditching & Drainage Rehabilitation,EN23DPG815,ITT,2022/09/14,1,2022/09/20,Skyline Resources Ltd.,McBride,British Columbia,Canada,"$175,241.36",2022/09/27,
WorkSafeBC,WorkSafeBC,Supply of Custom Solid Chocolate,230-2022,RFP,2022/05/12,0,2022/06/09,N/A,,,,$0.00,2022/09/23,
BC Timber Sales - Contracts,BC Timber Sales - Contracts,Timber Reconnaissance Surveys - Bulkley Lakes Morice,PD23TAA0301,ITT,2022/08/02,1,2022/08/24,Forsite Consultants Ltd.,Salmon Arm,British Columbia,Canada,"$120,000.00",2022/09/23,
Ministry of Forests,Ministry of Forests,Logging & Fiber Removal from MPB Impacted Stands in PG,SP23DPG810,ITT,2022/08/22,0,2022/09/20,575012 B.C. Ltd.,Prince George,British Columbia,Canada,"$81,900.00",2022/09/23,
Ministry of Transportation and Infrastructure - Construction,Ministry of Transportation and Infrastructure - Construction,Quick Bridge Superstructure Replacement,37737MJ0001,MOTITT,2022/08/17,5,2022/08/30,Luxton Construction Inc.,Vancouver,British Columbia,Canada,"$4,378,449.92",2022/09/21,
Ministry of Forests,Ministry of Forests,FFT Manual Brushing ,BR23DSN040,ITT,2022/09/14,1,2022/09/21,Rhino Reforestation Services Ltd,Prince George,British Columbia,Canada,"$71,471.40",2022/09/21,
Ministry of Forests,Ministry of Forests,FFT Manual Brushing ,BR23DSN040,ITT,2022/09/14,1,2022/09/21,Rhino Reforestation Services Ltd,Quesnel,British Columbia,Canada,"$71,471.40",2022/09/21,
Ministry of Forests,Ministry of Forests,Post Wildfire Silviculture Recce Surveys,SU23DRM002,ITT,2022/09/13,1,2022/09/20,Zanzibar Holding Ltd.,North Vancouver,British Columbia,Canada,"$17,584.00",2022/09/21,
Ministry of Transportation and Infrastructure - Construction,Ministry of Transportation and Infrastructure - Construction,Nicola River Bridge rehabilitation works,25299MJ0000,MOTITT,2022/08/11,3,2022/08/12,N/A,,,,$0.00,2022/09/20,
BC Timber Sales - Contracts,BC Timber Sales - Contracts,EN23TFD014-TKO-Road Construction Sproule South & East FSRs - KL,EN23TFD014,ITT,2022/08/17,0,2022/09/08,Alpine Logging Ltd.,Nelson,British Columbia,Canada,"$972,782.00",2022/09/20,
Ministry of Forests,Ministry of Forests,Detailed Aerial Bark Beetle Surveys in the Prince George Forest ,FH23DPG809,ITT,2022/08/22,1,2022/09/08,Sky Helicopters Inc.,Pitt Meadows,British Columbia,Canada,"$47,375.00",2022/09/20,
Ministry of Forests,Ministry of Forests,Quesnel FZ-Construction and M&E Services for a new warehouse bld,ITT23BCWSHQ015,ITT,2022/09/06,5,2022/09/13,Southwest Design & Construction Ltd.,Grande Prairie,Alberta,Canada,"$499,290.00",2022/09/19,
BC Timber Sales - Contracts,BC Timber Sales - Contracts,EN23TBP003 - Grading & Minor Road Maintenance Works,EN23TBP003,ITT,2022/08/24,1,2022/09/15,Rockline Construction Ltd. dba Capilano Highway Services,West Vancouver,British Columbia,Canada,"$53,888.80",2022/09/16,
City of Richmond,City of Richmond,On Call Glazing Contractor,8082Q,RFQ,2022/04/14,0,2022/05/10,Extreme Glass,Pitt Meadows,British Columbia,,$0.00,2022/09/15,
Ministry of Forests,Ministry of Forests,Small Scale Salvage Manual Brushing,BR23DSN041,ITT,2022/09/02,0,2022/09/15,Dewan Enterprise Ltd.,Victoria,British Columbia,Canada,"$56,535.90",2022/09/15,
Ministry of Forests,Ministry of Forests,Wildfire Rehabilitation Works in the Columbia Fire Zone,GS23DSE007,ITT,2022/08/08,0,2022/08/23,N/A,,,,$0.00,2022/09/15,
Ministry of Transportation and Infrastructure - Construction,Ministry of Transportation and Infrastructure - Construction,Replace the Temporary Gorge Ck Bridge with a Permanent Structure,24225MJ0000,MOTITT,2022/08/30,1,2022/09/07,Cutting Edge Consulting Inc.,Kamloops,British Columbia,Canada,"$1,417,360.00",2022/09/14,
Ministry of Transportation and Infrastructure - Construction,Ministry of Transportation and Infrastructure - Construction,Rock Slope Stabilization,86002MJ4569,MOTITT,2022/08/10,0,2022/09/08,Dynamite Construction Ltd.,Kamloops,British Columbia,Canada,"$483,120.00",2022/09/14,
Ministry of Transportation and Infrastructure - Construction,Ministry of Transportation and Infrastructure - Construction,Rock Slope Stabilization,86002MJ4569,MOTITT,2022/08/10,0,2022/09/08,Dynamite Construction Ltd.,Kamloops,British Columbia,Canada,"$483,120.00",2022/09/14,
Royal British Columbia Museum,Royal British Columbia Museum,Construction Management Services for Warehouse Tenant Imprmt,CRB CMG 2023 02,RFP,2022/06/03,1,2022/06/09,N/A,,,,$0.00,2022/09/14,
Ministry of Forests,Ministry of Forests,Repair Work and Maintenance of Bridges within the Stuart Nechako,EN23DSN031-A,ITT,2022/08/30,0,2022/09/14,Northern Road Service Ltd,Vanderhoof,British Columbia,Canada,"$30,926.00",2022/09/14,
Ministry of Forests,Ministry of Forests,Roadside Brushing,EN23DSN039-A,ITT,2022/08/30,0,2022/09/14,GDA Contracting Incorporated,Valemount,British Columbia,Canada,"$134,800.00",2022/09/14,
BC Timber Sales - Contracts,BC Timber Sales - Contracts,Seedling Transportation Services 2022,TRANSPORT-2022,ITT,2022/07/27,0,2022/08/24,Bartel Trucking Ltd.,Armstrong,British Columbia,Canada,"$170,000.00",2022/09/14,
BC Timber Sales - Contracts,BC Timber Sales - Contracts,Seedling Transportation Services 2022,TRANSPORT-2022,ITT,2022/07/27,0,2022/08/24,Hawkeye Holdings Ltd.,Kelowna,British Columbia,Canada,"$60,000.00",2022/09/14,
BC Timber Sales - Contracts,BC Timber Sales - Contracts,Seedling Transportation Services 2022,TRANSPORT-2022,ITT,2022/07/27,0,2022/08/24,High Country Cold Storage Ltd.,Kamloops,British Columbia,Canada,"$100,000.00",2022/09/14,
BC Timber Sales - Contracts,BC Timber Sales - Contracts,Seedling Transportation Services 2022,TRANSPORT-2022,ITT,2022/07/27,0,2022/08/24,Jackass Junction Ent. Ltd.,Williams Lake,British Columbia,Canada,"$20,000.00",2022/09/14,
BC Timber Sales - Contracts,BC Timber Sales - Contracts,Seedling Transportation Services 2022,TRANSPORT-2022,ITT,2022/07/27,0,2022/08/24,Scott Cunningham dba Mica Creek Contracting,Prince George,British Columbia,Canada,"$50,000.00",2022/09/14,
BC Timber Sales - Contracts,BC Timber Sales - Contracts,Seedling Transportation Services 2022,TRANSPORT-2022,ITT,2022/07/27,0,2022/08/24,Mike Andrews Trucking Ltd.,Saanichton,British Columbia,Canada,"$70,000.00",2022/09/14,
BC Timber Sales - Contracts,BC Timber Sales - Contracts,Seedling Transportation Services 2022,TRANSPORT-2022,ITT,2022/07/27,0,2022/08/24,Reimer Bros. Trucking Ltd.,Armstrong,British Columbia,Canada,"$150,000.00",2022/09/14,
Ministry of Transportation and Infrastructure - Construction,Ministry of Transportation and Infrastructure - Construction,Hwy 97A Swan Lk O/P to Pleasant Valley Rd CMB Installation,25193MJ0004,MOTITT,2022/08/04,0,2022/08/25,Kon Kast Concrete Products Inc.,Kelowna,British Columbia,Canada,"$1,537,427.89",2022/09/13,
Ministry of Transportation and Infrastructure - Construction,Ministry of Transportation and Infrastructure - Construction,Hwy 97A Swan Lk O/P to Pleasant Valley Rd CMB Installation,25193MJ0004,MOTITT,2022/08/04,0,2022/08/25,Kon Kast Concrete Products Inc.,Kelowna,British Columbia,Canada,"$1,537,427.89",2022/09/13,
Ministry of Public Safety & Solicitor Generalá& Emergency B.C.,Ministry of Public Safety & Solicitor Generalá& Emergency B.C.,Indigenous Cultural Liaison,ACCWICL2021C,SRFP,2022/02/01,2,2022/02/07,N/A,,,,$0.00,2022/09/13,
Ministry of Forests,Ministry of Forests,Road Maintenance on Duncan/Glacier FSR - Selkirk Forest District,EN23DSE006,ITT,2022/08/18,0,2022/08/31,Brenton Industries Ltd.,Kaslo,British Columbia,Canada,"$176,572.00",2022/09/13,
BC Timber Sales - Contracts,BC Timber Sales - Contracts,Douglas-fir Bark Beetle Surveys and Treatment Layout-CCBA       ,FH23TLH005,ITT,2022/07/19,0,2022/08/17,Juan Ditoro dba Q1 Contracting,Quesnel,British Columbia,Canada,"$95,460.00",2022/09/13,
Ministry of Transportation and Infrastructure - Construction,Ministry of Transportation and Infrastructure - Construction,Phibbs Transit Exchange Improvements,13038MJ2022,MOTITT,2022/08/18,6,2022/08/25,Conwest Contracting Ltd.,Vancouver,British Columbia,Canada,"$17,190,410.00",2022/09/12,
Ministry of Forests,Ministry of Forests,Finlay-Chunamon FSR Road Construction 71.2-7.48km,EN23PGN325,MOTITT,2022/06/29,0,2022/07/20,N/A,,,,$0.00,2022/09/09,
Ministry of Environment and Climate Change Strategy,,,CP23KAE012,ITT,,0,,N/A,,,,$0.00,2022/09/08,
Ministry of Forests,Ministry of Forests,"Maryland/Boundary FSR, Branch 7 and Branch 8 Deactivation",EN23DSE007,ITT,2022/08/11,0,2022/08/25,C.HI.L. Logging Ltd.,Cranbrook,British Columbia,Canada,"$73,700.00",2022/09/08,
Ministry of Forests,Ministry of Forests,Archaeological Services-Selkirk Forest District: Wildfire Rehab,GS23DSE009,ITT,2022/08/10,0,2022/08/24,Ursus Heritage Consulting Ltd.,Coldstream,British Columbia,Canada,"$32,300.00",2022/09/08,
Ministry of Forests,Ministry of Forests,Major- Mummary Bridge Berm/Rip Rap Installation at N3-014 Blaebr,EN23474034,ITT,2022/07/22,1,2022/08/23,N/A,,,,$0.00,2022/09/07,
Ministry of Forests,,,OT23FHQ165,ITT,,0,,Certes Applied & Natural Resources LTD,Kamloops,British Columbia,,"$5,680.00",2022/09/07,
Ministry of Transportation and Infrastructure - Construction,Ministry of Transportation and Infrastructure - Construction,Culvert Extension and Creek Liner Tie In,22440MJ0006,MOTITT,2022/08/17,1,2022/08/24,557969 BC Ltd. dba: Superior Excavating Ltd.,Peachland,British Columbia,Canada,"$996,545.00",2022/09/06,
Ministry of Forests,Ministry of Forests,KVR West Rail Trail Maintenance-Structure KV-039(22km West of,EN23474037,ITT,2022/08/17,2,2022/08/24,CRL Group Holdings Inc.,Summerland,British Columbia,Canada,"$185,040.00",2022/09/06,
BC Timber Sales - Contracts,BC Timber Sales - Contracts,Road Construction - BCTS White Lake and Ireland Operating Areas,EN23TKJ054,ITT,2022/07/22,1,2022/08/19,N/A,,,,$0.00,2022/09/06,
BC Timber Sales - Contracts,BC Timber Sales - Contracts,Preliminary Planning and Reconnaissance û Various Loc WL TSA,PD23TLE007,ITT,2022/07/26,0,2022/08/25,Coastal Natural Resource Management Ltd.,Vancouver,British Columbia,Canada,"$471,800.00",2022/09/06,
BC Timber Sales - Contracts,BC Timber Sales - Contracts,East Peacock FSR Construction (Morice TSA) ,EN23TAH3402,ITT,2022/07/28,0,2022/08/23,Groot Bros. Contracting Ltd.,Houston,Texas,United States,"$313,710.11",2022/09/02,
BC Timber Sales - Contracts,BC Timber Sales - Contracts,East Peacock FSR Construction (Morice TSA) ,EN23TAH3402,ITT,2022/07/28,0,2022/08/23,Groot Bros. Contracting Ltd.,Houston,Texas,United States,"$313,710.11",2022/09/02,
Ministry of Transportation and Infrastructure - Construction,Ministry of Transportation and Infrastructure - Construction,H3A and H97 Intersection Improvements,25876MJ0001,MOTITT,2022/07/21,1,2022/08/16,PeterÆs Bros. Construction Ltd.,Penticton,British Columbia,Canada,"$1,444,211.00",2022/09/01,
City of Richmond,City of Richmond,On Call Repair and Service Generator Contractor,8078Q,RFQ,2022/03/07,0,2022/04/04,Custom Power Generation,Coquitlam,British Columbia,,$0.00,2022/09/01,
Ministry of Forests,Ministry of Forests,KVR East Rail Trail Maintenance - Fife BC to Midway BC,EN23474036,ITT,2022/08/18,3,2022/08/24,N/A,,,,$0.00,2022/09/01,
BC Timber Sales - Contracts,BC Timber Sales - Contracts,Mechanical Site Preparation - Columbia Zone,SP23TKR019,ITT,2022/07/22,0,2022/08/19,Broken Branch Contracting Ltd.,Lumby,British Columbia,Canada,"$105,876.75",2022/09/01,
Ministry of Environment and Climate Change Strategy,Ministry of Environment and Climate Change Strategy,Construction and Delivery of Campfire Rings to Kamloops BC,RC23279-006,ITT,2022/08/02,1,2022/08/17,T-REX Metal Industries Ltd,Kamloops,British Columbia,Canada,"$16,425.00",2022/08/31,
Ministry of Environment and Climate Change Strategy,Ministry of Environment and Climate Change Strategy,Industrial Project Risk Rating Model,13453,RFP,2022/06/15,1,2022/07/04,KPMG LLP,Vancouver,British Columbia,Canada,"$99,900.00",2022/08/30,
BC Transit,,,21.097,NRFP,,0,,Moneris Solutions Corporation,Toronto,Ontario,,"$490,000.00",2022/08/30,
BC Timber Sales - Contracts,BC Timber Sales - Contracts,"BR23TKJ036 - Manual Brushing, TOC North Zone",BR23TKJ036,ITT,2022/07/13,1,2022/08/04,Leader Silviculture Ltd.,Naramata,British Columbia,Canada,"$95,682.50",2022/08/30,
Ministry of Forests,Ministry of Forests,Aerial Fertilization Selkirk,FE23DSE001,ITT,2022/08/26,2,2022/08/29,Western Aerial Applications Ltd.,Chilliwack,British Columbia,Canada,"$935,999.36",2022/08/30,
Ministry of Forests,Ministry of Forests,GS23RCL0001 - Site Inspection & Asbestos Testing ,GS23RCL0001,ITT,2022/08/19,3,2022/08/23,Peak Environmental Ltd.,West Kelowna,British Columbia,Canada,"$9,554.00",2022/08/30,
Ministry of Forests,Ministry of Forests,EN23LMN108 Dinner Rock FSR Works,EN23LMN108,ITT,2022/08/11,0,2022/08/29,Capilano Highway Services Company,West Vancouver,British Columbia,Canada,"$45,050.00",2022/08/29,
Ministry of Forests,Ministry of Forests,Haida Gwaii - Rennell Sound Dry Land Sort Quarry Work,EN23NAN807,ITT,2022/08/22,1,2022/08/26,Beachy Mechanical Ltd.,Port Clements,British Columbia,Canada,"$64,725.00",2022/08/29,
BC Timber Sales - Contracts,BC Timber Sales - Contracts,"EN23TEK410-FSR Inspections Merritt,Lillooet & 100 Mile House TSA",EN23TEK410,ITT,2022/08/17,1,2022/08/23,N/A,,,,$0.00,2022/08/29,
Ministry of Forests,Ministry of Forests,EN23LMN102,EN23LMN102,ITT,2022/08/04,0,2022/08/26,Tingtech Resources Inc.,Gibsons,British Columbia,Canada,"$17,202.00",2022/08/26,
Ministry of Forests,Ministry of Forests,Wildfire Risk Reduction Tactical Plan in the Mackenzie FD,1070-20/CS23DMK011,ITT,2022/07/18,0,2022/08/15,Frontera Forest Solutions Inc.,North Vancouver,British Columbia,Canada,"$57,165.00",2022/08/25,
Ministry of Transportation and Infrastructure - Construction,Ministry of Transportation and Infrastructure - Construction,Dunn  Lake Road Surfacing and Realignment,24130MJ0001,MOTITT,2022/08/11,1,2022/08/17,Dawson Civil Ltd.,Kamloops,British Columbia,Canada,"$9,790,584.20",2022/08/25,
Ministry of Transportation and Infrastructure - Construction,Ministry of Transportation and Infrastructure - Construction,Newsome Creek Culvert Replacement - London Lane Road,24619MJ0000,MOTITT,2022/07/26,1,2022/08/16,Cancelled,Victoria,British Columbia,Canada,$0.00,2022/08/25,
Ministry of Transportation and Infrastructure - Construction,Ministry of Transportation and Infrastructure - Construction,Newsome Creek Culvert Replacement - London Lane Road,24619MJ0000,MOTITT,2022/07/26,1,2022/08/16,CANCELLED,Victoria,British Columbia,Canada,$0.00,2022/08/25,
Ministry of Forests,Ministry of Forests,Heavy Equipment Wildfire Rehabilitation Works in the Arrow Fire ,GS23DSE008,ITT,2022/08/09,0,2022/08/23,Crescent Bay Construction Ltd.,Nakusp,British Columbia,Canada,"$30,662.00",2022/08/24,
Ministry of Forests,Ministry of Forests,Forest Grove Interface Fuel Break and Fuel Mgmt Prescription,LD23DMH011,ITT,2022/08/17,2,2022/08/22,Forsite Consultants Limited,Salmon Arm,British Columbia,Canada,"$36,266.00",2022/08/24,
BC Timber Sales - Contracts,BC Timber Sales - Contracts,Preliminary Planning & Reconnaissance Various Locations WLTSA,PD23TLE004,ITT,2022/07/21,1,2022/07/27,N/A,,,,$0.00,2022/08/24,
BC Timber Sales - Contracts,BC Timber Sales - Contracts,Preliminary Planning & Reconnaissance Various Locations WLTSA,PD23TLE004,ITT,2022/07/21,1,2022/07/27,N/A,,,,$0.00,2022/08/24,
BC Timber Sales - Contracts,BC Timber Sales - Contracts,Preliminary Planning & Reconnaissance Various Locations WLTSA,PD23TLE004,ITT,2022/07/21,1,2022/07/27,N/A,,,,$0.00,2022/08/24,
Ministry of Forests,Ministry of Forests,GBR Central Permanent Sample Plot (PSP) Sampling,1070-30/OT23FHQ153,ITT,2022/08/03,0,2022/08/23,N/A,,,,$0.00,2022/08/23,
Ministry of Transportation and Infrastructure - Construction,Ministry of Transportation and Infrastructure - Construction,Replacement of the east end jump spans with concrete girders.,24493MJ0000,MOTITT,2022/08/03,2,2022/08/10,Enviro-Ex Contracting Ltd,Prince George,British Columbia,Canada,"$1,845,690.00",2022/08/23,
Ministry of Forests,Ministry of Forests,GBR North Permanent Sample Plot (PSP) Sampling,1070-30/OT23FHQ152,ITT,2022/08/03,0,2022/08/22,N/A,,,,$0.00,2022/08/22,
BC Timber Sales - Contracts,BC Timber Sales - Contracts,Canyon Creek Br. 23 FSR Construction and Bridge Installation ,EN23TAH3407,ITT,2022/07/21,1,2022/08/16,Groot Bros. Contracting Ltd.,Houston,Texas,United States,"$88,290.46",2022/08/22,
Ministry of Forests,Ministry of Forests,GBR South CMI - Young Stand Monitoring Sampling,1070-30/OT23FHQ150,ITT,2022/08/03,0,2022/08/19,N/A,,,,$0.00,2022/08/19,
Ministry of Forests,Ministry of Forests,GBR Central CMI - Young Stand Monitoring Sampling,1070-30/OT23FHQ149,ITT,2022/08/03,0,2022/08/18,N/A,,,,$0.00,2022/08/18,
Ministry of Forests,Ministry of Forests,GBR Central CMI - Young Stand Monitoring Sampling,1070-30/OT23FHQ149,ITT,2022/08/03,0,2022/08/18,N/A,,,,$0.00,2022/08/18,
BC Timber Sales - Contracts,BC Timber Sales - Contracts,Blasting ,EN23TAH3405,ITT,2022/07/19,0,2022/08/15,Blastpro Construction Ltd.,Houston,Texas,United States,"$81,175.00",2022/08/18,
Ministry of Forests,Ministry of Forests,GS23DSE004 Wildfire Rehabilitation Specialist-N5 Arrow Fire Zone,GS23DSE004,ITT,2022/06/28,0,2022/07/14,Forsite Consultants Ltd,Salmon Arm,British Columbia,Canada,"$78,650.00",2022/08/18,
Ministry of Forests,Ministry of Forests,Wildfire Rehabilitation Specialist-N7 Kootenay Lake Fire Zone,GS23DSE006,ITT,2022/06/30,0,2022/07/18,Forsite Consultants Ltd,Salmon Arm,British Columbia,Canada,"$41,775.00",2022/08/18,
Ministry of Environment and Climate Change Strategy,Ministry of Environment and Climate Change Strategy,Construction and Delivery of Campsite picnic tables to Kamloops,RC23279-007,ITT,2022/08/04,1,2022/08/17,0992760 BC Ltd,Burnaby,British Columbia,Canada,"$60,420.00",2022/08/18,
Ministry of Forests,Ministry of Forests,Logging & Fiber Removal of MPB Impacted Stands in PG District,SP23DPG808,ITT,2022/07/27,1,2022/08/17,N/A,,,,$0.00,2022/08/18,
Ministry of Forests,Ministry of Forests,GBR CENTRAL NATIONAL FOREST INVENTORY (NFI) SAMPLING,1070-30/OT23FHQ141,ITT,2022/07/14,0,2022/07/28,N/A,,,,$0.00,2022/08/17,
Ministry of Forests,Ministry of Forests,GBR South-South Coast National Forest Inventory (NFI) Sampling,1070-30/OT23FHQ142,ITT,2022/07/28,2,2022/08/05,N/A,,,,$0.00,2022/08/17,
Ministry of Forests,Ministry of Forests,GBR South-South Coast National Forest Inventory (NFI) Sampling,1070-30/OT23FHQ142,ITT,2022/07/28,2,2022/08/05,N/A,,,,$0.00,2022/08/17,
Ministry of Forests,Ministry of Forests,GBR North Change Monitoring Inventory û Young Stand Monitoring,1070-30/OT23FHQ148,ITT,2022/08/03,0,2022/08/17,N/A,,,,$0.00,2022/08/17,
City of Richmond,City of Richmond,Quantity Surveyor Consulting Services - SCC and Branch Library,8100P,RFP,2022/05/19,0,2022/06/13,Turner & Townsend cm2r Inc.,Toronto,Ontario,,"$77,083.00",2022/08/17,
Provincial Health Services Authority (Incl. BCCSS),Provincial Health Services Authority (Incl. BCCSS),ITQ - Food Transport Services FHA - CRESST,PHSA 8982,ITQ,2022/05/06,1,2022/05/09,TForce Logistics Canada,Brampton,Ontario,,"$50,000.00",2022/08/17,
BC Timber Sales - Contracts,BC Timber Sales - Contracts,SP23TEF659-Mechanical Site PreparationûDisc TrenchûMerritt TSA,SP23TEF659,ITT,2022/07/07,0,2022/07/28,Green-Link Silviculture Inc,Williams Lake,British Columbia,Canada,"$39,368.54",2022/08/17,
BC Timber Sales - Contracts,BC Timber Sales - Contracts,Preliminary Planning & Reconnaissance - Williams Lake TSA,PD23TLE006,ITT,2022/06/28,0,2022/07/21,Oak Tree Forestry Services Ltd.,Kelowna,British Columbia,Canada,"$393,550.00",2022/08/16,
BC Timber Sales - Contracts,BC Timber Sales - Contracts,Aerial Photography - Various Locations - Cariboo-Chilcotin BA,SU23TLH011,ITT,2022/08/03,1,2022/08/09,Terrasaurus Aerial Photography Ltd.,Kamloops,British Columbia,Canada,"$39,692.44",2022/08/16,
Vancouver Island University,Vancouver Island University,Snow Removal and Ice Control Services,2022-5113,NRFP,2022/06/17,4,2022/07/04,N/A,,,,$0.00,2022/08/15,
Vancouver Island University,Vancouver Island University,Snow Removal and Ice Control Services,2022-5113,NRFP,2022/06/17,4,2022/07/04,N/A,,,,$0.00,2022/08/15,
WorkSafeBC,WorkSafeBC,Mental Health Strategic Advisory Services,215-2022,RFP,2022/03/16,2,2022/03/21,N/A,,,,$0.00,2022/08/15,
Ministry of Forests,Ministry of Forests,Bridal Deactivation,EN23LMN302,ITT,2022/07/11,0,2022/08/08,W.E. Stone Ltd.,Lillooet,British Columbia,Canada,"$788,347.52",2022/08/15,
Ministry of Forests,Ministry of Forests,Wildfire Rehabilitation Specialist-N6 Boundary Fire Zone,GS23DSE005,ITT,2022/06/29,0,2022/07/18,Solutions Forestry Services Ltd,Vernon,British Columbia,Canada,"$50,750.00",2022/08/15,
BC Timber Sales - Contracts,BC Timber Sales - Contracts,Timber Reconnaissance - Various Locations - Quesnel TSA,PD23TLH011,ITT,2022/06/20,0,2022/07/18,Copper Canyon Consulting Ltd.,Crofton,British Columbia,Canada,"$411,050.00",2022/08/15,
BC Timber Sales - Contracts,BC Timber Sales - Contracts,Timber Reconnaissance - Various Locations - Quesnel TSA,PD23TLH012,ITT,2022/06/20,0,2022/07/25,Copper Canyon Consulting Ltd.,Crofton,British Columbia,Canada,"$235,300.00",2022/08/15,
City of Kamloops,City of Kamloops,RFP Watermain Hot Tapping Services,344842,NRFP,2022/05/20,0,2022/06/10,Pacific Flow Control Ltd.,Kelowna,British Columbia,,$0.00,2022/08/12,
Ministry of Forests,Ministry of Forests,Preparation of a Wildfire Risk Reduction Tactical Plan,CS23DSN036,ITT,2022/07/29,0,2022/08/12,Frontera Forest Solutions Inc.,North Vancouver,British Columbia,Canada,"$57,165.00",2022/08/12,
BC Timber Sales - Contracts,BC Timber Sales - Contracts,EN23TFH007-Upper & Lower Sullivan Hill FSR Contraction-EK,EN23TFH007,ITT,2022/07/19,0,2022/08/04,Fiorentino Brothers Contracting Ltd.,Cranbrook,British Columbia,Canada,"$254,853.29",2022/08/12,
Ministry of Forests,Ministry of Forests,Helena Lake Landscape Fuel Break Layout & Fuel Mgmt Prescription,LD23DMH042,ITT,2022/06/17,0,2022/07/21,N/A,,,,$0.00,2022/08/12,
Ministry of Forests,Ministry of Forests,Helena Lake Landscape Fuel Break Layout & Fuel Mgmt Prescription,LD23DMH042,ITT,2022/06/17,0,2022/07/21,N/A,,,,$0.00,2022/08/12,
BC Housing Management Commission,BC Housing Management Commission,"Abatement and Demolition Services, Nanaimo BC",1070-2122-195,RFP,2022/05/13,6,2022/05/16,BROD Demolition Ltd,Nanaimo,British Columbia,,"$748,613.00",2022/08/11,
Ministry of Forests,Ministry of Forests,Moldowan FSR Road Upgrade 0-17km,13480,ITT,2022/07/14,2,2022/07/27,Capco Construction Ltd.,Prince George,British Columbia,Canada,"$291,430.00",2022/08/11,
Ministry of Public Safety & Solicitor Generalá& Emergency B.C.,,,Duncan2022-IJP,SRFP,,0,,Hiiye yu Lelum House of Friendship,Duncan,British Columbia,,"$21,606.00",2022/08/11,
Ministry of Public Safety & Solicitor Generalá& Emergency B.C.,,,GVic2022-IJP,SRFP,,0,,N/A,,,,$0.00,2022/08/11,
BC Timber Sales - Contracts,BC Timber Sales - Contracts,"Fall 2022 and Spring 2023 Tree Planting, Campbell River",PL23TCG023,ITT,2022/07/25,1,2022/08/08,ZANZIBAR HOLDINGS LTD.,North Vancouver,British Columbia,Canada,"$479,564.60",2022/08/11,
BC Timber Sales - Contracts,,,BR23TBS001,ITT,,0,,4C Forestry Ltd.,Victoria,British Columbia,,"$244,548.50",2022/08/10,
Ministry of Forests,Ministry of Forests,Routine Bridge and Major Culvert Inspections û Rail Trails ,EN23474030,ITT,2022/07/08,1,2022/08/03,SNT Engineering Ltd.,Nelson,British Columbia,Canada,"$21,280.00",2022/08/10,
BC Timber Sales - Contracts,BC Timber Sales - Contracts,Watershed Hydrological Assessment û Various Locations - CCBA,PD23TLA013,ITT,2022/07/20,0,2022/08/10,N/A,,,,$0.00,2022/08/10,
BC Timber Sales - Contracts,BC Timber Sales - Contracts,Mechanical Site Preparation-Mounding and Screefing-WLTSA,SP23TLE003,ITT,2022/07/19,2,2022/07/25,Wyatt Consulting Ltd.,Vernon,British Columbia,Canada,"$352,028.10",2022/08/10,
BC Timber Sales - Contracts,BC Timber Sales - Contracts,Mechanical Site Prep Deep Ripping Various Locations WLTSA,SP23TLE005,ITT,2022/07/05,0,2022/08/08,Elhdaqox Developments Ltd.,Williams Lake,British Columbia,Canada,"$221,712.00",2022/08/10,
BC Timber Sales - Contracts,BC Timber Sales - Contracts,Mechanical Site Prep Deep Ripping Various Locations WLTSA,SP23TLE005,ITT,2022/07/05,0,2022/08/08,Elhdaqox Developments Ltd.,Williams Lake,British Columbia,Canada,"$221,712.00",2022/08/10,
Ministry of Forests,Ministry of Forests,Bridge Repairs at Clinton/Loon FSR 21.2KM 64-011,EN23474027,ITT,2022/07/25,1,2022/07/28,Big Rock Construction Company Ltd.,Kamloops,British Columbia,Canada,"$157,750.35",2022/08/09,
